{
  "title": "GDPR Article 32 Gap Analysis",
  "summary": "Assessment of technical and organisational measures against GDPR Article 32 requirements. 4 of 7 controls are fully in place; 2 are partially implemented; 1 is not in place.",
  "scope": "All systems processing personal data in the EU",
  "regulation": "GDPR",
  "scoring_scheme": {
    "dimensions": ["compliance"],
    "scale": [
      { "value": "in_place",    "label": "In place",          "color": "#27AE60" },
      { "value": "partial",     "label": "Partially in place", "color": "#F5A623" },
      { "value": "not_in_place","label": "Not in place",       "color": "#E74C3C" }
    ]
  },
  "items": [
    {
      "id": "A32-1",
      "requirement": "Pseudonymisation and encryption of personal data",
      "reference": "Art. 32(1)(a)",
      "current_state": "AES-256 at rest for primary DB; TLS 1.3 in transit. No pseudonymisation in analytics tables.",
      "gap_description": "Analytics warehouse stores email addresses in plaintext.",
      "score": "partial",
      "priority": "high",
      "owner": "Head of Data",
      "effort": "M",
      "target_date": "2026-06-30",
      "recommendations": ["Introduce hash-based pseudonymisation for analytics", "Rotate analytics access tokens"]
    },
    {
      "id": "A32-2",
      "requirement": "Ongoing confidentiality, integrity, availability and resilience",
      "reference": "Art. 32(1)(b)",
      "current_state": "Multi-AZ deployment, daily backups, 4-hour RTO.",
      "gap_description": "",
      "score": "in_place",
      "priority": "low",
      "owner": "CTO",
      "effort": "S"
    },
    {
      "id": "A32-3",
      "requirement": "Ability to restore availability and access to personal data in a timely manner",
      "reference": "Art. 32(1)(c)",
      "current_state": "Backups tested quarterly.",
      "score": "in_place",
      "priority": "low",
      "effort": "S"
    },
    {
      "id": "A32-4",
      "requirement": "Regular testing, assessing and evaluating the effectiveness of measures",
      "reference": "Art. 32(1)(d)",
      "current_state": "Annual pentest by third party; no continuous monitoring.",
      "gap_description": "No continuous control testing; reliance on annual pentest is insufficient for a 4,000-employee SaaS.",
      "score": "partial",
      "priority": "medium",
      "owner": "CISO",
      "effort": "L",
      "target_date": "2026-09-30"
    },
    {
      "id": "A32-5",
      "requirement": "Processor obligations under Art. 28 where applicable",
      "reference": "Art. 32(4)",
      "current_state": "No DPA template in place for subprocessors added after Feb 2026.",
      "score": "not_in_place",
      "priority": "critical",
      "owner": "DPO",
      "effort": "M",
      "target_date": "2026-05-15",
      "recommendations": ["Draft DPA template", "Re-paper 6 subprocessors"]
    }
  ],
  "summary_statistics": {
    "total_items": 5,
    "by_score": { "in_place": 2, "partial": 2, "not_in_place": 1 },
    "by_priority": { "critical": 1, "high": 1, "medium": 1, "low": 2 }
  }
}
